{
  "$schema": "http://json-schema.org/draft-07/schema#",
  "title": "Nitro Modules Configuration",
  "type": "object",
  "required": ["cxxNamespace", "apple", "android"],
  "definitions": {
    "name": {
      "type": "string",
      "pattern": "^[a-zA-Z_][a-zA-Z0-9_]*$",
      "not": {
        "enum": ["nitro", "NitroModules"]
      }
    }
  },
  "properties": {
    "environment": {
      "type": "string",
      "enum": ["react-native", "bare"],
      "default": "react-native",
      "description": "Selects the package imported by generated JavaScript runtime modules: react-native-nitro-modules for react-native, or nitro-core for bare."
    },
    "cxxNamespace": {
      "type": "array",
      "items": {
        "$ref": "#/definitions/name"
      },
      "minItems": 1,
      "description": "Represents the C++ namespace of the module that will be generated. This can have multiple sub-namespaces, and is always relative to `margelo::nitro`."
    },
    "apple": {
      "type": "object",
      "required": ["moduleName"],
      "properties": {
        "moduleName": {
          "$ref": "#/definitions/name",
          "description": "Represents the Apple module name of the module that will be generated. It names the generated Swift module and SwiftPM library product. Use the same name in the library's `swiftpmConfig` in package.json."
        }
      },
      "description": "Required: Apple configuration, for iOS, macOS, tvOS and visionOS"
    },
    "android": {
      "type": "object",
      "required": ["namespace", "cxxLibName"],
      "properties": {
        "namespace": {
          "type": "array",
          "items": {
            "$ref": "#/definitions/name"
          },
          "minItems": 1,
          "description": "Represents the Android namespace ('package') of the module that will be generated. This can have multiple sub-namespaces, and is always relative to `com.margelo.nitro`."
        },
        "cxxLibName": {
          "$ref": "#/definitions/name",
          "description": "Represents the name of the Android C++ library (aka name in CMakeLists.txt `add_library(..)`). This will be loaded via `System.loadLibrary(...)`."
        }
      },
      "description": "Required: Android configuration"
    },
    "ignorePaths": {
      "type": "array",
      "items": {
        "type": "string"
      },
      "description": "A list of paths relative to the project directory that should be ignored by nitrogen. Nitrogen will not look for `.nitro.ts` files in these directories."
    },
    "autolinking": {
      "not": {},
      "description": "Removed. Autolinking moved to `.nitro.ts`: declare an `implementation` in each platform decorator and a public constructor to enable `new`."
    }
  }
}
