{
  "$schema": "https://nitro.margelo.com/nitro.schema.json",
  "environment": "react-native",
  "cxxNamespace": ["test", "external"],
  "apple": {
    "moduleName": "NitroTestExternal"
  },
  "android": {
    "namespace": ["test", "external"],
    "cxxLibName": "NitroTestExternal"
  },
  "ignorePaths": ["**/node_modules"]
}
